{
  "contract": { "name": "ExploreTargetContextV1", "version": "1.0.0" },
  "workspaceId": "10000000-0000-4000-8000-000000000001",
  "readinessGoal": {
    "readinessGoalId": "30000000-0000-4000-8000-000000000003",
    "readinessGoalKey": "goal:personal-main",
    "lifecycle": "paused",
    "aggregateVersion": "2"
  },
  "targetProfile": {
    "profileVersionId": "40000000-0000-4000-8000-000000000004",
    "profileVersionKey": "target:personal-main-v1",
    "catalogVersionKey": "catalog:seed-v1",
    "roadmapVersionKey": null,
    "rootRuleKey": "rule:personal-floor",
    "readinessThreshold": 0.8
  },
  "overlayVersion": "3",
  "requirementRules": [
    {
      "ruleKey": "rule:personal-floor",
      "ruleType": "MANDATORY_FLOOR",
      "title": "Personal Linux floor",
      "criticality": "MANDATORY",
      "explanation": "The accepted personal competency must be completed.",
      "accessibilityLabel": "Mandatory personal Linux competency floor.",
      "requiredCount": null,
      "threshold": null,
      "members": [
        {
          "memberType": "NODE",
          "nodeScope": "workspace_overlay",
          "nodeType": "COMPETENCY",
          "nodeRef": "competency:personal-linux",
          "dimension": "APPLICATION",
          "requiredLevel": "COMPLETED",
          "weight": null
        }
      ]
    }
  ],
  "scope": {
    "requiredCanonicalNodeRefs": [],
    "requiredOverlayNodeRefs": ["competency:personal-linux"],
    "roadmapNodeRefs": [],
    "prerequisiteClosureNodeRefs": [],
    "canonicalNodes": [
      {
        "nodeRef": "domain:linux",
        "nodeType": "DOMAIN",
        "title": "Linux",
        "description": "Linux systems capabilities.",
        "domainRef": null
      }
    ],
    "canonicalEdges": [],
    "requiredOverlayNodes": [
      {
        "nodeRef": "competency:personal-linux",
        "nodeType": "COMPETENCY",
        "title": "Personal Linux triage",
        "domainRef": "domain:linux",
        "workspaceId": "10000000-0000-4000-8000-000000000001"
      }
    ]
  }
}
